{
  "schema_version": "cacp.community_artifact.v0.1",
  "artifact_id": "artifact-shared-garden-maintenance-notice-update",
  "artifact_type": "resident_notice",
  "contract_id": "ctc-shared-garden-maintenance-notice-update",
  "created_by": "actor-community-operator-console",
  "created_at": "2026-06-26T02:00:00Z",
  "visibility": "community_summary",
  "contains_personal_data": false,
  "summary": "Synthetic updated public notice explaining a changed shared garden maintenance window, superseded earlier notice, safe boundary, alternate access, and operator contact path.",
  "retention": "task_lifetime",
  "data_policy": "fictional_or_synthetic_only"
}
