{
  "schema_version": "cacp.community_artifact.v0.1",
  "artifact_id": "artifact-playground-repair-resident-notice",
  "artifact_type": "resident_notice",
  "contract_id": "ctc-temporary-playground-repair-notice",
  "created_by": "actor-community-operator-console",
  "created_at": "2026-06-25T02:00:00Z",
  "visibility": "community_summary",
  "contains_personal_data": false,
  "summary": "Synthetic public notice explaining the temporary playground repair window, safe boundary, alternate route, and operator contact path.",
  "retention": "task_lifetime",
  "data_policy": "fictional_or_synthetic_only"
}
