{
  "schema_version": "cacp.community_artifact.v0.1",
  "artifact_id": "artifact-elder-walk-resident-notice",
  "artifact_type": "resident_notice",
  "contract_id": "ctc-elder-friendly-walking-helper",
  "created_by": "actor-community-operator-console",
  "created_at": "2026-06-24T08:00:00Z",
  "visibility": "participant_and_operator",
  "contains_personal_data": false,
  "summary": "Synthetic plain-language notice describing the optional helper walk and exit path.",
  "retention": "task_lifetime",
  "data_policy": "fictional_or_synthetic_only"
}
