{
  "schema_version": "cacp.community_artifact.v0.1",
  "artifact_id": "artifact-playground-repair-incident-notice-update",
  "artifact_type": "resident_notice",
  "contract_id": "ctc-playground-repair-notice-incident-review",
  "created_by": "actor-community-operator-console",
  "created_at": "2026-06-25T04:13:00Z",
  "visibility": "community_summary",
  "contains_personal_data": false,
  "summary": "Synthetic resident notice update explaining that playground repair is paused for incident review, the prior detour is blocked, and a human operator contact path remains available.",
  "retention": "task_lifetime",
  "data_policy": "fictional_or_synthetic_only"
}
