{
  "schema_version": "cacp.community_artifact.v0.1",
  "artifact_id": "artifact-basketball-schedule-record",
  "artifact_type": "schedule_record",
  "contract_id": "ctc-evening-basketball-social-pulse",
  "created_by": "actor-community-operator-console",
  "created_at": "2026-06-24T09:00:00Z",
  "visibility": "participant_and_operator",
  "contains_personal_data": false,
  "summary": "Synthetic schedule confirmation for the low-pressure evening basketball Pulse.",
  "retention": "task_lifetime",
  "data_policy": "fictional_or_synthetic_only"
}
