{
  "schema_version": "cacp.community_artifact.v0.1",
  "artifact_id": "artifact-robot-patrol-approval-record",
  "artifact_type": "approval_record",
  "contract_id": "ctc-robot-fire-passage-patrol",
  "created_by": "actor-community-operator-console",
  "created_at": "2026-06-24T10:00:00Z",
  "visibility": "operator_only",
  "contains_personal_data": false,
  "summary": "Synthetic operator approval confirming bounded route, manual stop, and no raw video storage.",
  "retention": "audit_period",
  "data_policy": "fictional_or_synthetic_only"
}
